{
  "$schema": "https://json-schema.org/draft/2020-12/schema",
  "$id": "https://dengon.local/contracts/events/batch.schema.json",
  "title": "Corps de POST /ingest/batch",
  "description": "Lot d'événements poussé par un nœud. Réf : docs/synthese/09 §9 (exemple de batch).",
  "type": "object",
  "additionalProperties": false,
  "required": ["batch_id", "node_id", "schema_version", "events", "sig"],
  "properties": {
    "batch_id": {
      "type": "string",
      "pattern": "^[0-9a-f]{64}$",
      "minLength": 64,
      "maxLength": 64,
      "description": "Identifiant du lot (hex SHA-256)."
    },
    "node_id": {
      "$ref": "envelope.schema.json#/$defs/node_id",
      "description": "Nœud émetteur du lot. Doit correspondre au node_id de chaque événement."
    },
    "schema_version": {
      "type": "integer",
      "minimum": 1,
      "description": "Version du catalogue. Ajout de champ = rétrocompatible ; changement de sens = incrément."
    },
    "events": {
      "type": "array",
      "minItems": 1,
      "maxItems": 1000,
      "description": "Borné indépendamment de la limite en octets de l'API (DENGON_DASHBOARD_MAX_BATCH_BYTES, #59) : un nombre illimité d'événements minuscules validerait quand même chacun jusqu'au stockage avant d'atteindre la limite d'octets (retour de revue #60 round 4, point d'OswinFreyr).",
      "items": { "$ref": "envelope.schema.json" }
    },
    "sig": {
      "type": "string",
      "pattern": "^[A-Za-z0-9+/]{86}==$",
      "minLength": 88,
      "maxLength": 88,
      "description": "base64(Ed25519(canonical_json(batch privé du champ 'sig'))). 64 octets → 88 caractères base64. Voir CANONICAL.md."
    }
  }
}
